{
  "kind": "feed",
  "name": "eol",
  "version": "2.0.0",
  "published_by": "feeds",
  "published_at": "2026-07-31T16:22:39+01:00",
  "payload_schema": "eol/payload.schema.json",
  "payload": {
    "feed_version": "v2",
    "published_by": "feeds",
    "currency": "GBP",
    "changelog": "v2: added kyverno-1.10 (eol 2024-08-01, endoflife.date/kyverno) -- a component the platform now runs that endoflife.date started tracking; no other entries changed.",
    "note": "endoflife.date-style feed: component -> eol date + a base unpatched-CVE annual rate at end of support. Consumed as a *time-varying* risk: to_fair_scenario.py ramps loss-event-frequency by how far `--as-of` sits past eol_date, so a policy version going unmaintained is priced like any other EOL risk, not a bespoke sunset.",
    "components": {
      "python-3.9": {
        "eol_date": "2025-10-31",
        "source": "endoflife.date/python",
        "base_lef": [
          1,
          3,
          6
        ],
        "base_lm_gbp": [
          2000,
          10000,
          40000
        ]
      },
      "ubuntu-20.04": {
        "eol_date": "2025-04-30",
        "source": "endoflife.date/ubuntu",
        "base_lef": [
          1,
          2,
          5
        ],
        "base_lm_gbp": [
          2000,
          15000,
          60000
        ]
      },
      "istio-1.18": {
        "eol_date": "2024-02-21",
        "source": "endoflife.date/istio",
        "base_lef": [
          2,
          5,
          10
        ],
        "base_lm_gbp": [
          5000,
          30000,
          120000
        ]
      },
      "kyverno-1.10": {
        "eol_date": "2024-08-01",
        "source": "endoflife.date/kyverno",
        "base_lef": [
          1,
          2,
          4
        ],
        "base_lm_gbp": [
          3000,
          20000,
          80000
        ]
      }
    }
  }
}
