{
  "kind": "feed",
  "name": "threat-register",
  "version": "3.0.1",
  "published_by": "feeds",
  "published_at": "2026-09-10T08:07:23+00:00",
  "payload_schema": "threat-register/payload.schema.v3.json",
  "payload": {
    "feed_version": "v2",
    "published_by": "platform",
    "changelog": "v2: tuppence lef raised 3,6,14 -> 4,9,20 -- reflects the 2026 uptick in API-based account-takeover fraud reported across UK fintechs (industry roundup, not a driftwood-specific incident). Other institutions unchanged.",
    "note": "institution threat register -- annual loss-event-frequency (lef) per institution's headline threat, editorial and grounded in publicly reported incident base rates (Verizon DBIR sector breach-frequency ranges), not a live threat-intel subscription.",
    "institutions": {
      "driftwood": {
        "threat": "cart/checkout PII exfiltration",
        "flavour": "e-commerce, short-life cart data, high traffic/low sensitivity per-record",
        "lef": [
          2,
          4,
          9
        ],
        "source": "DBIR retail-sector web-app-attack base rate, editorial midpoint"
      },
      "tuppence": {
        "threat": "payment-fraud / account-takeover via API abuse",
        "flavour": "fintech, FCA/PCI, availability+fraud flavour",
        "lef": [
          4,
          9,
          20
        ],
        "source": "DBIR financial-sector base rate + 2026 UK fintech ATO-uptick roundup, editorial midpoint"
      },
      "ludlow": {
        "threat": "confidential health-record exfiltration",
        "flavour": "HIPAA, decades-confidential, HNDL/harvest-now-decrypt-later exposure",
        "lef": [
          1,
          2,
          5
        ],
        "source": "DBIR healthcare-sector base rate, editorial midpoint -- lower frequency, far higher confidentiality horizon"
      }
    }
  }
}
