{
  "kind": "feed",
  "name": "cve",
  "version": "1.0.0",
  "published_by": "feeds",
  "published_at": "2026-07-31T16:22:39+01:00",
  "payload_schema": "cve/payload.schema.json",
  "payload": {
    "feed_version": "v1",
    "published_by": "feeds",
    "currency": "GBP",
    "note": "trivy/GHSA-style CVE feed for images the estate runs. Shape mirrors `trivy image --format json` + GHSA severity, trimmed to what fair.py needs: cvss score -> loss-magnitude band, epss (exploit-probability proxy) -> loss-event-frequency band. lm bands are editorial CVSS->impact-\u00a3 tiers (not a real breach-cost dataset), consistent across the feed.",
    "severity_lm_gbp": {
      "critical": [
        50000,
        150000,
        400000
      ],
      "high": [
        10000,
        40000,
        120000
      ],
      "medium": [
        1000,
        8000,
        30000
      ],
      "low": [
        100,
        1000,
        5000
      ]
    },
    "cves": {
      "CVE-2024-1234-envoy": {
        "component": "istio/envoy",
        "cvss": 9.1,
        "severity": "critical",
        "epss": 0.42,
        "published": "2024-02-01",
        "source": "GHSA-xxxx (illustrative, shape-accurate to a real envoy RCE class)"
      },
      "CVE-2023-4567-curl": {
        "component": "curl (base image dep)",
        "cvss": 7.5,
        "severity": "high",
        "epss": 0.18,
        "published": "2023-10-11",
        "source": "trivy scan, curl heap-overflow class"
      },
      "CVE-2023-9999-openssl": {
        "component": "openssl (base image dep)",
        "cvss": 5.3,
        "severity": "medium",
        "epss": 0.06,
        "published": "2023-06-01",
        "source": "trivy scan, openssl info-leak class"
      }
    }
  }
}
